<?xml version="1.0" encoding="UTF-8"?>
<dictionary xmlns:xsi="http://www.w3.org/2001/XMLSchema-instance"
xsi:noNamespaceSchemaLocation="english_chinese.xsd">

<word id="9175" name="ji&#224;o">
<source name="english">yeast</source>
<target name="chinese">
<dialect name="mandarin">
<pronunciation>ji&#224;o</pronunciation>
<characters style="simplified">é…µ</characters>
</dialect>

<!-- <dialect name="cantonese">
<pronunciation>ji&#224;o</pronunciation>
<characters style="simplified">same</characters>
</dialect> -->

</target>
<url>
<gif src="resources/img/9175.gif" />
<audio src="resources/audio/9175.wav" />
</url>
</word>
</dictionary>