<?xml version="1.0" encoding="UTF-8"?>
<dictionary xmlns:xsi="http://www.w3.org/2001/XMLSchema-instance"
xsi:noNamespaceSchemaLocation="english_chinese.xsd">

<word id="8346" name="j&#299;ng">
<source name="english">(surname) , thorns , brambles</source>
<target name="chinese">
<dialect name="mandarin">
<pronunciation>j&#299;ng</pronunciation>
<characters style="simplified">荆</characters>
</dialect>

<!-- <dialect name="cantonese">
<pronunciation>j&#299;ng</pronunciation>
<characters style="simplified">荊</characters>
</dialect> -->

</target>
<url>
<gif src="resources/img/8346.gif" />
<audio src="resources/audio/8346.wav" />
</url>
</word>
</dictionary>