<?xml version="1.0" encoding="UTF-8"?>
<dictionary xmlns:xsi="http://www.w3.org/2001/XMLSchema-instance"
xsi:noNamespaceSchemaLocation="english_chinese.xsd">

<word id="8c1b" name="d&#236;">
<source name="english">examine , truth (Buddhist)</source>
<target name="chinese">
<dialect name="mandarin">
<pronunciation>d&#236;</pronunciation>
<characters style="simplified">ш░Ы</characters>
</dialect>

<!-- <dialect name="cantonese">
<pronunciation>d&#236;</pronunciation>
<characters style="simplified">шлж</characters>
</dialect> -->

</target>
<url>
<gif src="resources/img/8c1b.gif" />
<audio src="resources/audio/8c1b.wav" />
</url>
</word>
</dictionary>