<?xml version="1.0" encoding="UTF-8"?>
<dictionary xmlns:xsi="http://www.w3.org/2001/XMLSchema-instance"
xsi:noNamespaceSchemaLocation="english_chinese.xsd">

<word id="86b1" name="zh&#224;">
<source name="english">grasshopper</source>
<target name="chinese">
<dialect name="mandarin">
<pronunciation>zh&#224;</pronunciation>
<characters style="simplified">èš±</characters>
</dialect>

<!-- <dialect name="cantonese">
<pronunciation>zh&#224;</pronunciation>
<characters style="simplified">same</characters>
</dialect> -->

</target>
<url>
<gif src="resources/img/86b1.gif" />
<audio src="resources/audio/86b1.wav" />
</url>
</word>
</dictionary>