<?xml version="1.0" encoding="UTF-8"?>
<dictionary xmlns:xsi="http://www.w3.org/2001/XMLSchema-instance"
xsi:noNamespaceSchemaLocation="english_chinese.xsd">

<word id="58c1" name="b&#236;">
<source name="english">wall , rampart</source>
<target name="chinese">
<dialect name="mandarin">
<pronunciation>b&#236;</pronunciation>
<characters style="simplified">Â£Å</characters>
</dialect>

<!-- <dialect name="cantonese">
<pronunciation>b&#236;</pronunciation>
<characters style="simplified">same</characters>
</dialect> -->

</target>
<url>
<gif src="resources/img/58c1.gif" />
<audio src="resources/audio/58c1.wav" />
</url>
</word>
</dictionary>