<?xml version="1.0" encoding="UTF-8"?>
<dictionary xmlns:xsi="http://www.w3.org/2001/XMLSchema-instance"
xsi:noNamespaceSchemaLocation="english_chinese.xsd">

<word id="79df" name="z&#363;">
<source name="english">rent , taxes</source>
<target name="chinese">
<dialect name="mandarin">
<pronunciation>z&#363;</pronunciation>
<characters style="simplified">ç§Ÿ</characters>
</dialect>

<!-- <dialect name="cantonese">
<pronunciation>z&#363;</pronunciation>
<characters style="simplified">same</characters>
</dialect> -->

</target>
<url>
<gif src="resources/img/79df.gif" />
<audio src="resources/audio/79df.wav" />
</url>
</word>
</dictionary>