<?xml version="1.0" encoding="UTF-8"?>
<dictionary xmlns:xsi="http://www.w3.org/2001/XMLSchema-instance"
xsi:noNamespaceSchemaLocation="english_chinese.xsd">

<word id="6c22" name="q&#299;ng">
<source name="english">hydrogen</source>
<target name="chinese">
<dialect name="mandarin">
<pronunciation>q&#299;ng</pronunciation>
<characters style="simplified">氢</characters>
</dialect>

<!-- <dialect name="cantonese">
<pronunciation>q&#299;ng</pronunciation>
<characters style="simplified">氫</characters>
</dialect> -->

</target>
<url>
<gif src="resources/img/6c22.gif" />
<audio src="resources/audio/6c22.wav" />
</url>
</word>
</dictionary>