<?xml version="1.0" encoding="UTF-8"?>
<dictionary xmlns:xsi="http://www.w3.org/2001/XMLSchema-instance"
xsi:noNamespaceSchemaLocation="english_chinese.xsd">

<word id="8bda" name="ch&#233;ng">
<source name="english">honest , sincere , true</source>
<target name="chinese">
<dialect name="mandarin">
<pronunciation>ch&#233;ng</pronunciation>
<characters style="simplified">诚</characters>
</dialect>

<!-- <dialect name="cantonese">
<pronunciation>ch&#233;ng</pronunciation>
<characters style="simplified">誠</characters>
</dialect> -->

</target>
<url>
<gif src="resources/img/8bda.gif" />
<audio src="resources/audio/8bda.wav" />
</url>
</word>
</dictionary>