<?xml version="1.0" encoding="UTF-8"?>
<dictionary xmlns:xsi="http://www.w3.org/2001/XMLSchema-instance"
xsi:noNamespaceSchemaLocation="english_chinese.xsd">

<word id="60e9" name="ch&#233;ng">
<source name="english">punish , discipline</source>
<target name="chinese">
<dialect name="mandarin">
<pronunciation>ch&#233;ng</pronunciation>
<characters style="simplified">惩</characters>
</dialect>

<!-- <dialect name="cantonese">
<pronunciation>ch&#233;ng</pronunciation>
<characters style="simplified">懲</characters>
</dialect> -->

</target>
<url>
<gif src="resources/img/60e9.gif" />
<audio src="resources/audio/60e9.wav" />
</url>
</word>
</dictionary>