<?xml version="1.0" encoding="UTF-8"?>
<dictionary xmlns:xsi="http://www.w3.org/2001/XMLSchema-instance"
xsi:noNamespaceSchemaLocation="english_chinese.xsd">

<word id="72b6" name="zhu&#224;ng">
<source name="english">accusation , suit , state , condition , strong , great</source>
<target name="chinese">
<dialect name="mandarin">
<pronunciation>zhu&#224;ng</pronunciation>
<characters style="simplified">状</characters>
</dialect>

<!-- <dialect name="cantonese">
<pronunciation>zhu&#224;ng</pronunciation>
<characters style="simplified">狀</characters>
</dialect> -->

</target>
<url>
<gif src="resources/img/72b6.gif" />
<audio src="resources/audio/72b6.wav" />
</url>
</word>
</dictionary>