<?xml version="1.0" encoding="UTF-8"?>
<dictionary xmlns:xsi="http://www.w3.org/2001/XMLSchema-instance"
xsi:noNamespaceSchemaLocation="english_chinese.xsd">

<word id="5fac" name="p&#225;ng">
<source name="english">irresolute</source>
<target name="chinese">
<dialect name="mandarin">
<pronunciation>p&#225;ng</pronunciation>
<characters style="simplified">å¾¬</characters>
</dialect>

<!-- <dialect name="cantonese">
<pronunciation>p&#225;ng</pronunciation>
<characters style="simplified">same</characters>
</dialect> -->

</target>
<url>
<gif src="resources/img/5fac.gif" />
<audio src="resources/audio/5fac.wav" />
</url>
</word>
</dictionary>