<?xml version="1.0" encoding="UTF-8"?>
<dictionary xmlns:xsi="http://www.w3.org/2001/XMLSchema-instance"
xsi:noNamespaceSchemaLocation="english_chinese.xsd">

<word id="87fe" name="ch&#225;n">
<source name="english">moon , (striped) toad</source>
<target name="chinese">
<dialect name="mandarin">
<pronunciation>ch&#225;n</pronunciation>
<characters style="simplified">èŸ¾</characters>
</dialect>

<!-- <dialect name="cantonese">
<pronunciation>ch&#225;n</pronunciation>
<characters style="simplified">same</characters>
</dialect> -->

</target>
<url>
<gif src="resources/img/87fe.gif" />
<audio src="resources/audio/87fe.wav" />
</url>
</word>
</dictionary>