<?xml version="1.0" encoding="UTF-8"?>
<dictionary xmlns:xsi="http://www.w3.org/2001/XMLSchema-instance"
xsi:noNamespaceSchemaLocation="english_chinese.xsd">

<word id="51b7" name="l&#283;ng">
<source name="english">cold</source>
<target name="chinese">
<dialect name="mandarin">
<pronunciation>l&#283;ng</pronunciation>
<characters style="simplified">å†·</characters>
</dialect>

<!-- <dialect name="cantonese">
<pronunciation>l&#283;ng</pronunciation>
<characters style="simplified">same</characters>
</dialect> -->

</target>
<url>
<gif src="resources/img/51b7.gif" />
<audio src="resources/audio/51b7.wav" />
</url>
</word>
</dictionary>