<?xml version="1.0" encoding="UTF-8"?>
<dictionary xmlns:xsi="http://www.w3.org/2001/XMLSchema-instance"
xsi:noNamespaceSchemaLocation="english_chinese.xsd">

<word id="72f8" name="l&#237;">
<source name="english">(dog) , wild cat</source>
<target name="chinese">
<dialect name="mandarin">
<pronunciation>l&#237;</pronunciation>
<characters style="simplified">ç‹¸</characters>
</dialect>

<!-- <dialect name="cantonese">
<pronunciation>l&#237;</pronunciation>
<characters style="simplified">same</characters>
</dialect> -->

</target>
<url>
<gif src="resources/img/72f8.gif" />
<audio src="resources/audio/72f8.wav" />
</url>
</word>
</dictionary>