<?xml version="1.0" encoding="UTF-8"?>
<dictionary xmlns:xsi="http://www.w3.org/2001/XMLSchema-instance"
xsi:noNamespaceSchemaLocation="english_chinese.xsd">

<word id="4e3b" name="zh&#468;">
<source name="english">to own , to host , master , lord , primary</source>
<target name="chinese">
<dialect name="mandarin">
<pronunciation>zh&#468;</pronunciation>
<characters style="simplified">ä¸»</characters>
</dialect>

<!-- <dialect name="cantonese">
<pronunciation>zh&#468;</pronunciation>
<characters style="simplified">same</characters>
</dialect> -->

</target>
<url>
<gif src="resources/img/4e3b.gif" />
<audio src="resources/audio/4e3b.wav" />
</url>
</word>
</dictionary>