<?xml version="1.0" encoding="UTF-8"?>
<dictionary xmlns:xsi="http://www.w3.org/2001/XMLSchema-instance"
xsi:noNamespaceSchemaLocation="english_chinese.xsd">

<word id="86b5" name="&#233;">
<source name="english">oyster</source>
<target name="chinese">
<dialect name="mandarin">
<pronunciation>&#233;</pronunciation>
<characters style="simplified">èšµ</characters>
</dialect>

<!-- <dialect name="cantonese">
<pronunciation>&#233;</pronunciation>
<characters style="simplified">same</characters>
</dialect> -->

</target>
<url>
<gif src="resources/img/86b5.gif" />
<audio src="resources/audio/86b5.wav" />
</url>
</word>
</dictionary>