<?xml version="1.0" encoding="UTF-8"?>
<dictionary xmlns:xsi="http://www.w3.org/2001/XMLSchema-instance"
xsi:noNamespaceSchemaLocation="english_chinese.xsd">

<word id="6479" name="m&#243;">
<source name="english">imitate , copy</source>
<target name="chinese">
<dialect name="mandarin">
<pronunciation>m&#243;</pronunciation>
<characters style="simplified">æ‘¹</characters>
</dialect>

<!-- <dialect name="cantonese">
<pronunciation>m&#243;</pronunciation>
<characters style="simplified">same</characters>
</dialect> -->

</target>
<url>
<gif src="resources/img/6479.gif" />
<audio src="resources/audio/6479.wav" />
</url>
</word>
</dictionary>