<?xml version="1.0" encoding="UTF-8"?>
<dictionary xmlns:xsi="http://www.w3.org/2001/XMLSchema-instance"
xsi:noNamespaceSchemaLocation="english_chinese.xsd">

<word id="7126" name="ji&#257;o">
<source name="english">burnt , scorched , worried , anxious</source>
<target name="chinese">
<dialect name="mandarin">
<pronunciation>ji&#257;o</pronunciation>
<characters style="simplified">ç„¦</characters>
</dialect>

<!-- <dialect name="cantonese">
<pronunciation>ji&#257;o</pronunciation>
<characters style="simplified">same</characters>
</dialect> -->

</target>
<url>
<gif src="resources/img/7126.gif" />
<audio src="resources/audio/7126.wav" />
</url>
</word>
</dictionary>