<?xml version="1.0" encoding="UTF-8"?>
<dictionary xmlns:xsi="http://www.w3.org/2001/XMLSchema-instance"
xsi:noNamespaceSchemaLocation="english_chinese.xsd">

<word id="6cbe" name="zh&#257;n">
<source name="english">infected by , moisten , receive favors</source>
<target name="chinese">
<dialect name="mandarin">
<pronunciation>zh&#257;n</pronunciation>
<characters style="simplified">æ²¾</characters>
</dialect>

<!-- <dialect name="cantonese">
<pronunciation>zh&#257;n</pronunciation>
<characters style="simplified">same</characters>
</dialect> -->

</target>
<url>
<gif src="resources/img/6cbe.gif" />
<audio src="resources/audio/6cbe.wav" />
</url>
</word>
</dictionary>