<?xml version="1.0" encoding="UTF-8"?>
<dictionary xmlns:xsi="http://www.w3.org/2001/XMLSchema-instance"
xsi:noNamespaceSchemaLocation="english_chinese.xsd">

<word id="7231" name="&#224;i">
<source name="english">to love , affection , to be fond of , to like</source>
<target name="chinese">
<dialect name="mandarin">
<pronunciation>&#224;i</pronunciation>
<characters style="simplified">爱</characters>
</dialect>

<!-- <dialect name="cantonese">
<pronunciation>&#224;i</pronunciation>
<characters style="simplified">愛</characters>
</dialect> -->

</target>
<url>
<gif src="resources/img/7231.gif" />
<audio src="resources/audio/7231.wav" />
</url>
</word>
</dictionary>