<?xml version="1.0" encoding="UTF-8"?>
<dictionary xmlns:xsi="http://www.w3.org/2001/XMLSchema-instance"
xsi:noNamespaceSchemaLocation="english_chinese.xsd">

<word id="82b1" name="hu&#257;">
<source name="english">flower , blossom , to spend (money, time) , fancy pattern</source>
<target name="chinese">
<dialect name="mandarin">
<pronunciation>hu&#257;</pronunciation>
<characters style="simplified">èŠ±</characters>
</dialect>

<!-- <dialect name="cantonese">
<pronunciation>hu&#257;</pronunciation>
<characters style="simplified">same</characters>
</dialect> -->

</target>
<url>
<gif src="resources/img/82b1.gif" />
<audio src="resources/audio/82b1.wav" />
</url>
</word>
</dictionary>