<?xml version="1.0" encoding="UTF-8"?>
<dictionary xmlns:xsi="http://www.w3.org/2001/XMLSchema-instance"
xsi:noNamespaceSchemaLocation="english_chinese.xsd">

<word id="9e92" name="q&#237;">
<source name="english">mythical unicorn</source>
<target name="chinese">
<dialect name="mandarin">
<pronunciation>q&#237;</pronunciation>
<characters style="simplified">éº’</characters>
</dialect>

<!-- <dialect name="cantonese">
<pronunciation>q&#237;</pronunciation>
<characters style="simplified">same</characters>
</dialect> -->

</target>
<url>
<gif src="resources/img/9e92.gif" />
<audio src="resources/audio/9e92.wav" />
</url>
</word>
</dictionary>