<?xml version="1.0" encoding="UTF-8"?>
<dictionary xmlns:xsi="http://www.w3.org/2001/XMLSchema-instance"
xsi:noNamespaceSchemaLocation="english_chinese.xsd">

<word id="6652" name="sh&#224;i">
<source name="english">to sun</source>
<target name="chinese">
<dialect name="mandarin">
<pronunciation>sh&#224;i</pronunciation>
<characters style="simplified">æ™’</characters>
</dialect>

<!-- <dialect name="cantonese">
<pronunciation>sh&#224;i</pronunciation>
<characters style="simplified">same</characters>
</dialect> -->

</target>
<url>
<gif src="resources/img/6652.gif" />
<audio src="resources/audio/6652.wav" />
</url>
</word>
</dictionary>