<?xml version="1.0" encoding="UTF-8"?>
<dictionary xmlns:xsi="http://www.w3.org/2001/XMLSchema-instance"
xsi:noNamespaceSchemaLocation="english_chinese.xsd">

<word id="6572" name="qi&#257;o">
<source name="english">extort , knock , to strike , to knock (at a door) , to hit</source>
<target name="chinese">
<dialect name="mandarin">
<pronunciation>qi&#257;o</pronunciation>
<characters style="simplified">æ•²</characters>
</dialect>

<!-- <dialect name="cantonese">
<pronunciation>qi&#257;o</pronunciation>
<characters style="simplified">same</characters>
</dialect> -->

</target>
<url>
<gif src="resources/img/6572.gif" />
<audio src="resources/audio/6572.wav" />
</url>
</word>
</dictionary>